{
  "recordId": "11111111-1111-4111-8111-111111111111",
  "hubId": "22222222-2222-4222-8222-222222222222",
  "backendOrigin": "https://fixture.supabase.co",
  "accountId": "33333333-3333-4333-8333-333333333333",
  "curriculumId": "fixture-course",
  "cloudRevision": 7,
  "publishedLocalRevision": 0
}
